[
  {
    "change_event_id": "CE-2026-0001",
    "kind": "amendment",
    "subject_type": "authority-document",
    "subject_id": "EU_AI_ACT",
    "old_version": "(EU) 2024/1689",
    "new_version": "(EU) 2024/1689 — Digital Omnibus revision (proposed)",
    "summary": "Digital Omnibus proposal would link high-risk application dates to support-tool availability. Latest application dates revised to 2 Dec 2027 (Annex III high-risk) and 2 Aug 2028 (Annex I product-linked high-risk), conditional on support-tool availability. Original 2 Aug 2026 baseline preserved until formal adoption.",
    "delta_refs": ["Art. 113", "Annex I", "Annex III"],
    "downstream_impact": [
      { "target_type": "applicability-test", "target_id": "APP-EUAI-HIGH-RISK-ANNEXIII-001", "impact_kind": "re-assess" }
    ],
    "effective_at": "2027-12-02T00:00:00Z",
    "published_at": "2026-02-12T00:00:00Z",
    "source": {
      "authority_id": "eu-ec",
      "url": "https://digital-strategy.ec.europa.eu/en/policies/regulatory-framework-ai",
      "citation": "European Commission AI Act standardisation page (consulted 2026-05-16)"
    }
  },
  {
    "change_event_id": "CE-2026-0002",
    "kind": "new-publication",
    "subject_type": "framework",
    "subject_id": "ISO_42001",
    "old_version": "n/a",
    "new_version": "ISO/IEC 42001:2023",
    "summary": "First international standard for AI management systems (AIMS). Establishes a PDCA cycle for organisations developing, providing or using AI; integrates with ISO/IEC 27001 + 27701.",
    "delta_refs": ["Cl. 4-10", "Annex A", "Annex B", "Annex C"],
    "effective_at": "2023-12-18T00:00:00Z",
    "published_at": "2023-12-18T00:00:00Z",
    "source": {
      "authority_id": "iso-iec",
      "url": "https://www.iso.org/standard/81230.html",
      "citation": "ISO/IEC 42001:2023 — Information technology — Artificial intelligence — Management system"
    }
  },
  {
    "change_event_id": "CE-2026-0003",
    "kind": "amendment",
    "subject_type": "framework",
    "subject_id": "PCI_DSS",
    "old_version": "PCI DSS v4.0",
    "new_version": "PCI DSS v4.0.1",
    "summary": "PCI SSC published v4.0.1 — clarifications + minor corrections to v4.0. No new requirements. Future-dated requirements (Req. 8.3.6, 12.10.4.1, etc.) remain best-practice until 31 March 2025, then mandatory.",
    "delta_refs": ["Req. 8.3.6", "Req. 12.10.4.1"],
    "downstream_impact": [
      { "target_type": "control", "target_id": "CTRL-IAM-MFA-001", "impact_kind": "definitely-changed" }
    ],
    "effective_at": "2024-06-01T00:00:00Z",
    "published_at": "2024-06-01T00:00:00Z",
    "source": {
      "authority_id": "pci-ssc",
      "url": "https://www.pcisecuritystandards.org/document_library/?category=pcidss",
      "citation": "PCI DSS v4.0.1 (PCI Security Standards Council, June 2024)"
    },
    "supersedes": []
  }
]
